153	0.455	This was also expressed by Lady Ashton when she visited the Tunisian authorities in Tunis yesterday, offering them political and financial support.	Tunisian
154	0.516	I should therefore like to congratulate the Commission on proposing to us the introduction of biometric identifiers containing an image and fingerprints in interoperable formats.	biometric
155	0.547	Main aspects of the common foreign and security policy and the common security and defence policy - Situation in Syria and in Camp Ashraf - Report: Albertini - Annual report from the Council to Parliament on the main aspects of CFSP in 2009 - Report: Gualtieri - Development of CSDP following the entry into force of the Lisbon Treaty - Report: Muñiz De Urquiza - The EU as a global actor: its role in multilateral organisations (debate)	multilateral
156	0.429	Developing innovation policy is crucial to EU competitiveness and our ability to keep good jobs in Europe.	EU
157	0.422	The taxation policy pursued by the Member States should be consistent with the Community's objectives in terms of job creation, EU competitiveness, the single market and free movement of capital.	EU
158	0.500	More than 40 000 direct jobs and 16 000 indirect jobs have been created with the help of the International Fund and it has created employment opportunities in an economically disadvantaged region.	disadvantaged
159	0.250	In subsequent budgetary policy I think that Parliament should ensure that the priorities are that the EU is able to increase its own contribution, that the budget supports material efficiency and policy on climate change through its own choice of policies, and that in this way the Europe 2020 Strategy and a greener economy are achieved.	own
160	0.283	Free movement for people within the EU and the absence of controls at internal borders bring a shared responsibility and an increased requirement for proper and effective management of our external borders.	external
161	0.444	– A6-0324/2005 by Mr Becsey, on behalf of the Committee on Economic and Monetary Affairs, on the proposal for a Council directive laying down detailed rules for the refund of value added tax, provided for in Directive 77/388/EEC, to taxable persons not established in the territory of the country but established in another Member State (COM(2004)0728 – C6-0251/2005 – 2005/0807(CNS)) and	taxable
162	0.562	The report aims to illustrate how the common values on which the EU is based translate into concrete human rights-related activities in its bilateral relations with third countries, in multilateral fora and in relation to a number of thematic issues.	multilateral
163	0.347	However, it is of interest to all Member States belonging to the Schengen agreement, not merely those which have external borders, to ensure that external border controls are effective; certain measures have therefore been taken to promote solidarity and cooperation between Member States in this area.	external
164	0.533	The next item is the debate on the report (A5-0027/2003) by Mr Caudron, on behalf of the Committee on Industry, External Trade, Research and Energy, on the proposal for a decision of the European Parliament and of the Council on Community participation in a research and development programme aimed at developing new clinical interventions to combat HIV/AIDS, malaria and tuberculosis through a long term partnership between Europe and the developing countries, undertaken by a number of Member States and Norway (COM(2002) 474 - C5-0392/2002 - 2002/0211(COD))	development
165	0.500	Under Article 7(2) of the Act of 20 September 1976 as amended on 25 June and 23 September 2002 these Members have had incompatible mandates since 26 June 2007, the date of the constituent sitting of the French National Assembly.	incompatible
166	0.344	The next item is the report by Mrs Fajon, on behalf of the Committee on Civil Liberties, Justice and Home Affairs, on the proposal for a regulation of the European Parliament and of the Council amending Regulation (EC) No 539/2001 listing the third countries whose nationals must be in possession of visas when crossing the external borders of Member States and those whose nationals are exempt from that requirement - C7-0134/2010 -.	external
167	0.234	You understand the importance of free peoples and free markets, and so do our voters.	free
168	0.550	And I witnessed two godforsaken and inhumane totalitarian dictatorships - under Stalin, who succeeded Lenin, and Hitler - their rise to power and their terrible demise.	totalitarian
169	0.368	Secondly, I should like to point out that we have managed to secure a separate consumer programme after all, one with its own budget and that can develop its own momentum, and I think this is something the consumers will appreciate.	consumer
170	0.406	The Sandinista apparatus began to duplicate state apparatus, following the example of the Cuban Committees for the Defence of the Revolution.	state
171	0.362	It is still not clear whether the introduction of biometric identifiers really does increase security or whether it is rather a threat to security through the risks of abuse, technological flaws and lack of transparency and sound data protection.	biometric
172	0.500	These e-mails come from an organisation called Pesticide Watch, whose constituent organisations received large amounts of funding from the European Commission - indeed, part of the EUR 11.7 million spent in the last two years under the budget line relating to the Community action programme promoting non-governmental organisations (NGOs) primarily active in the field of environmental protection and the Life+ programme.	constituent
173	0.347	A Europe open to the world, to the suffering and aspirations of other peoples in all countries; above all, a Europe open to peace and the search for personal and collective security.	collective
174	0.461	The next item is the report by Csaba Sándor Tabajdi, on behalf of the Committee on Agriculture and Rural Development, on sustainable agriculture and biogas: a need for review of EU legislation.	sustainable
175	0.533	You will remember that, before that, last March, the Greek President-in-Office of the Council, Mr Papandreou, outlined to a Parliamentary delegation the parts of the Statute which were acceptable to the Council and which were not.	Parliamentary
176	0.432	These events mainly concern Iraq, Egypt, Pakistan, Turkey, China and Vietnam, and in fact the intense coordination carried out in the last few days and the consequent unearthing of numerous episodes that have occurred outside the Middle East has led us to find a new, more fitting title, which is 'serious events which compromise Christian communities' existence and those of other religious communities'.	consequent
177	0.531	Structural policies and EU cohesion (debate)	EU
178	0.544	Ladies and gentlemen, ten years have passed since the Iraqi air force attacked a village of 50 000 inhabitants, most of whom were refugees from the surrounding area and civilians, located in Labja in Iraqi Kurdistan.	Iraqi
179	0.391	(ES) Mr President, before moving on to the final item, on behalf of many Members of this Parliament I would like to express my profound sadness and discontent.	profound
180	0.339	I have tabled an amendment to the Lyon report, recital Ae: 'whereas the CAP must be geared to the maintenance and development of multifunctional, sustainable agriculture throughout Europe.'	sustainable
181	0.300	At the same time, it has been suggesting to the Member States that there is a need for sustainable taxation and fiscal consolidation for the future.	sustainable
182	0.375	Unfortunately, ETA has once again revealed its true colours, namely its preference for blind terrorism that rejects democracy and scorns all types of freedom, including one of the most fundamental, which is freedom of expression.	blind
183	0.447	Structural policies and EU cohesion (vote)	EU
